{
  "$schema": "../schema.json",
  "city": "Ribeirão das Neves",
  "domain": "Ribeirao das Neves",
  "latitude": -19.7745768,
  "longitude": -44.0860605,
  "downloadLink": "http://www.rotativodigital.com.br/app/?city=neves",
  "termsLink": "http://www.rotativodigital.com.br/wp-content/uploads/2021/10/termos-de-uso-ribeirao-das-neves.pdf",
  "androidPackage": "com.rotativodigitalneves",
  "iosPackage": "com.rotativodigitalneves",
  "products": [7],
  "vehicleTypes": [1],
  "mainLogo": "",
  "logoMenu": "",
  "balance": {
    "showBy": "real",
    "showDetails": false
  },
  "parkingRules": {
    "1": [
      {"time": 60, "price": 2, "credits": 1},
      {"time": 120, "price": 2, "credits": 1},
      {"time": 240, "price": 2, "credits": 1}
    ]
  },
  "parkingRulesText": "O valor de cada crédito para estacionamento rotativo é de R$2,00. O tempo máximo de duração de cada crédito é o tempo de permanência informado na placa de sinalização, próximo ao local do veículo estacionado.",
  "purchase": {
    "vehicleTypeDefault": 1,
    "showBy": "credits",
    "chargeback": true,
    "minCreditsByVehicle": {
      "1": 1
    },
    "products": {
      "1": [
        {
          "credits": 5,
          "price": 10
        },
        {
          "credits": 10,
          "price": 20
        },
        {
          "credits": 15,
          "price": 30
        },
        {
          "credits": 25,
          "price": 50
        }
      ]
    },
    "payment": {
      "creditCard": true,
      "billet": true
    }
  },
  "faq": [
    {
      "title": "O que é o Rotativo Digital Neves?",
      "content": "O Sistema de estacionamento Rotativo tem como objetivo, aumentar a oferta de vagas nas regiões de grande concentração de comércio, serviços e lazer, oferecendo aos motoristas mais facilidade de estacionamento, contribuindo para melhorar a qualidade de vida, assim como proporcionar o aumento da fluidez do trânsito.\n\nA receita líquida obtida com o pagamento das vagas, é revertida para projetos de melhoria do sistema viário da cidade.\n\nEm RIBEIRÃO DAS NEVES, a Secretaria Municipal De Segurança, Trânsito E Transporte Departamento de Trânsito – SMSTT é o órgão responsável pelo gerenciamento do Estacionamento ROTATIVO DIGITAL NEVES. Com os Decretos Municipais nº. 59 de 8 de maio de 2.017 e nº. 117 de 21 de junho de 2018, e através da Concorrência Pública nº 002/2018, onde a empresa Ti.Mob – Tecnologia e Soluções de Mobilidade, sagrou-se vencedora do certame como empresa especializada para execução dos serviços de Gestão, comercialização de Créditos Eletrônicos e equipamentos para fiscalização."
    },
    {
      "title": "Como funciona o Rotativo Digital",
      "content": "O sistema ROTATIVO DIGITAL NEVES é um sistema moderno, que tem como objetivo proporcionar conforto, praticidade e uma série de vantagens para a população de sua cidade.\n\nPara utilização do sistema estacionamento ROTATIVO DIGITAL NEVES, o usuário deverá possuir CRÉDITOS ELETRÔNICOS ATIVOS para a vaga em que está estacionado.\n\nPara maior comodidade e conforto da população foram disponibilizadas 02 formas de utilização dos créditos:\na) compra/ativação de CRÉDITO ELETRÔNICO AVULSO para usuários que fizerem uso do estacionamento pontualmente;\nb) compra de CRÉDITOS PRÉ-PAGOS, onde os usuários que forem recorrentes podem optar por se cadastrar no sistema e comprar uma maior quantidade de créditos, e ativar somente quando for utilizar a vaga de estacionamento rotativo.\n\nA Ti.Mob também disponibiliza aos USUÁRIOS do ROTATIVO DIGITAL NEVES aplicativo “ROTATIVO DIGITAL NEVES” (disponível nas lojas de aplicativos Google Play e Apple Store), além do site: www.rotativodigital.com.br/ribeirao-das-neves.\n\nAo estacionar em uma das vagas de estacionamento ROTATIVO DIGITAL NEVES, o usuário deverá ATIVAR créditos de estacionamento."
    },
    {
      "title": "Valor e tempo do estacionamento",
      "content": "O valor de cada crédito de estacionamento no ROTATIVO DIGITAL NEVES é de R$ 2,00 (dois reais) válidos por permanência conforme a área de estacionamento, que poderá variar entre 1, 2 ou 4 horas. Ao estacionar, verifique a placa de regulamentação com o tempo permitido para este local."
    },
    {
      "title": "Horário de funcionamento",
      "content": "O sistema de Estacionamento Rotativo de RIBEIRÃO DAS NEVES funciona de segunda à  sexta feira de 8 às 18 horas e aos  sábado das 8h às 13horas. Domingos e feriados não há cobrança. "
    },
    {
      "title": "Como funciona a fiscalização",
      "content": "Os Agentes de Trânsito de RIBEIRÃO DAS NEVES fazem a fiscalização através de sistema disponível em seus equipamentos smartphones, bem como através de um veículo de videomonitoramento. A consulta é realizada pela placa do veículo. Caso detectado que o veículo está estacionado de forma irregular, será automaticamente autuado. Em alguns casos, poderá ocorrer a remoção do veículo. "
    },
    {
      "title": "Quantidade de veículos cadastrados em um mesmo CPF",
      "content": "Você pode ter até cinco veículos cadastrados em seu CPF. "
    },
    {
      "title": "Vagas especiais",
      "content": "O uso da Credencial de Estacionamento Especial para Idosos e portadores de necessidades especiais é obrigatório em todas as vagas reservadas, localizadas ou não em áreas de estacionamento rotativo.\n\nO usuário destas vagas, deverá fazer o pagamento do valor de estacionamento, assim como os demais usuários nas vagas de uso comum."
    },
    {
      "title": "Onde posso comprar e ativar os meus créditos?",
      "content": "Os CRÉDITOS ELETRÔNICOS podem ser adquiridos através de Pontos de venda espalhados pela cidade nas áreas do Estacionamento Rotativo ou através do aplicativo ROTATIVO DIGITAL NEVES, é rápido, fácil e seguro."
    },
    {
      "title": "Vendi/troquei meu veículo, como faço para transferir os créditos que possuia para o novo veículo?",
      "content": "Por medida de segurança e para que se evite fraudes, seus CRÉDITOS ELETRÔNICOS adquiridos são vinculados ao seu CPF como usuário, e não às Placas de seus veículos. Nesse caso, basta que o veículo transferido seja retirado e o novo veículo seja cadastrado. Daí a necessidade do condutor informar seu CPF ao cadastrar como usuário do estacionamento rotativo.  "
    }
  ]
}
